job_id,title,company,location,description,experience_level,source,source_url,fetched_at,is_target_job,clean_title,clean_description,extracted_skills,skills_text,role_category,skill_extraction_provider,skill_extraction_error
greenhouse:stripe:7793069,Treasury Finance AI and Quantitative Analytics,stripe,New York,"Who we are About Stripe Stripe is a financial infrastructure platform for businesses. Millions of companies—from the world's largest enterprises to the most ambitious startups—use Stripe to accept payments, grow their revenue, and accelerate new business opportunities. Our mission is to increase the GDP of the internet, and we have a staggering amount of work ahead. That means you have an unprecedented opportunity to put the global economy within everyone's reach while doing the most important work of your career. About the team At its core, Stripe is a treasury company, and the Treasury Finance team is key to building the Global Payments and Treasury Network (GPTN). We collaborate closely with product, engineering, sales, and finance teams to create innovative solutions that enhance our financial capabilities. As part of the Treasury Finance AI and Quantitative Analytics team, you'll work at the intersection of finance, artificial intelligence, and product development, building autonomous agents and intelligent solutions that enhance treasury capabilities and enable us to better serve and scale with the global economy. What you'll do Within Treasury Finance AI and Quantitative Analytics, you'll leverage your finance, artificial intelligence (AI), and technical expertise to build intelligent solutions that enhance treasury capabilities. You'll develop AI-powered tools and models, autonomous agents, and data products that automate complex workflows and provide actionable insights. Working at the intersection of artificial intelligence, finance, and product development, you'll collaborate with engineering and finance teams to deploy cutting-edge AI applications that scale with our growth and support our mission of increasing the GDP of the internet. Responsibilities Apply your treasury and finance domain expertise to identify high-impact opportunities where AI can solve complex liquidity, financial risk management, and capital markets challenges Build AI-powered tools and artificial intelligence solutions to automate treasury workflows, enhance risk management, and scale our operations Design and deploy autonomous AI agents using frameworks like LangChain and LangGraph that can reason, plan, and execute complex multi-step problems and enhance decision-making processes Ship interactive data products and self-service analytics tools using Python frameworks (Streamlit, Dash, Gradio) that provide real-time insights and actionable intelligence Work across Treasury Finance and partner teams to scope AI-driven solutions that allow us to optimize and scale our most complex, data-driven financial workflows Explore and prototype cutting-edge AI applications to address emerging treasury challenges Who you are We're looking for someone who meets the minimum requirements to be considered for the role. If you meet these requirements, you are encouraged to apply. The preferred qualifications are a bonus, not a requirement. Minimum requirements Bachelor's degree in finance, mathematics, computer science, engineering, or a related field with 5+ years of work experience in software development, data science, or treasury and finance roles Working familiarity with financial risk and capital markets concepts Proficiency in Python and experience with AI and ML frameworks including PyTorch and TensorFlow Experience with Large Language Model (LLM) frameworks such as LangChain, LangGraph, or similar tools for building AI applications and agentic systems Solid understanding of AI fundamentals, including deep learning, natural language processing, and generative AI Results-oriented, with a focus on delivering impact in a fast-paced environment Excellent communication skills for collaborating with product, engineering, and finance teams Highly organized, with attention to detail and the ability to manage tight deadlines Preferred qualifications Familiarity with the payments industry and fintech landscape Experience with Databricks and cloud platforms (AWS, GCP, Azure) Software engineering experience in Ruby 6410 Treasury Finance US",Entry Level,greenhouse,https://stripe.com/jobs/search?gh_jid=7793069,2026-06-10T18:17:28.260174+00:00,True,treasury finance ai and quantitative analytics,"who we are about stripe stripe is a financial infrastructure platform for businesses. millions of companies—from the world's largest enterprises to the most ambitious startups—use stripe to accept payments, grow their revenue, and accelerate new business opportunities. our mission is to increase the gdp of the internet, and we have a staggering amount of work ahead. that means you have an unprecedented opportunity to put the global economy within everyone's reach while doing the most important work of your career. about the team at its core, stripe is a treasury company, and the treasury finance team is key to building the global payments and treasury network (gptn). we collaborate closely with product, engineering, sales, and finance teams to create innovative solutions that enhance our financial capabilities. as part of the treasury finance ai and quantitative analytics team, you'll work at the intersection of finance, artificial intelligence, and product development, building autonomous agents and intelligent solutions that enhance treasury capabilities and enable us to better serve and scale with the global economy. what you'll do within treasury finance ai and quantitative analytics, you'll leverage your finance, artificial intelligence (ai), and technical expertise to build intelligent solutions that enhance treasury capabilities. you'll develop ai-powered tools and models, autonomous agents, and data products that automate complex workflows and provide actionable insights. working at the intersection of artificial intelligence, finance, and product development, you'll collaborate with engineering and finance teams to deploy cutting-edge ai applications that scale with our growth and support our mission of increasing the gdp of the internet. responsibilities apply your treasury and finance domain expertise to identify high-impact opportunities where ai can solve complex liquidity, financial risk management, and capital markets challenges build ai-powered tools and artificial intelligence solutions to automate treasury workflows, enhance risk management, and scale our operations design and deploy autonomous ai agents using frameworks like langchain and langgraph that can reason, plan, and execute complex multi-step problems and enhance decision-making processes ship interactive data products and self-service analytics tools using python frameworks (streamlit, dash, gradio) that provide real-time insights and actionable intelligence work across treasury finance and partner teams to scope ai-driven solutions that allow us to optimize and scale our most complex, data-driven financial workflows explore and prototype cutting-edge ai applications to address emerging treasury challenges who you are we're looking for someone who meets the minimum requirements to be considered for the role. if you meet these requirements, you are encouraged to apply. the preferred qualifications are a bonus, not a requirement. minimum requirements bachelor's degree in finance, mathematics, computer science, engineering, or a related field with 5+ years of work experience in software development, data science, or treasury and finance roles working familiarity with financial risk and capital markets concepts proficiency in python and experience with ai and ml frameworks including pytorch and tensorflow experience with large language model (llm) frameworks such as langchain, langgraph, or similar tools for building ai applications and agentic systems solid understanding of ai fundamentals, including deep learning, natural language processing, and generative ai results-oriented, with a focus on delivering impact in a fast-paced environment excellent communication skills for collaborating with product, engineering, and finance teams highly organized, with attention to detail and the ability to manage tight deadlines preferred qualifications familiarity with the payments industry and fintech landscape experience with databricks and cloud platforms (aws, gcp, azure) software engineering experience in ruby 6410 treasury finance us","['python', 'aws', 'pytorch', 'tensorflow']","python, aws, pytorch, tensorflow",AI/ML,dictionary,
greenhouse:airbnb:7902817,"Systems Engineer, BizTech(Python, LLM, GenAI, MCP)",airbnb,"Bangalore, India","Airbnb was born in 2007 when two hosts welcomed three guests to their San Francisco home, and has since grown to over 5 million hosts who have welcomed over 2 billion guest arrivals in almost every country across the globe. Every day, hosts offer unique stays and experiences that make it possible for guests to connect with communities in a more authentic way. Systems Engineer Airbnb | India Airbnb has built a global platform that connects travellers and hosts across 34,000 cities, offering more than two million listings worldwide. We run mission-critical enterprise systems that operate around the clock across all time zones. These systems are essential to enabling our teams to work efficiently and productively. As our Business Technology organization continues to expand, we are seeking highly motivated individuals who thrive in a fast-paced, high-performing team environment. The Systems Engineer role focuses on designing, building, and maintaining Finance integrations and reports on oracle. The role is part of a team that builds and maintains the enterprise platform powering Airbnb's business operations; spanning finance, procurement, analytics, and internal tooling. While Oracle/Finance integrations are a core area, you'll also contribute to AI-assisted automation, and cross-functional systems that serve teams across the company. Role & Responsibilities: Design, build and manage integrations and micro services in Python. Design and build AI-assisted automations and MCP integrations to extend internal platform capabilities. Document the Designs and Runbooks and Participate in the full Software Development Life Cycle (SDLC). Share knowledge with other members in the team. Support the Application infrastructure including OCI and more. Understanding the requirements for different Oracle modules and coming up with solutions to review with the team and present to stakeholders. Requirements: Bachelors in Computer Science or Engineering 5+ years experience in Python programming language. Experience in securing data; understands PGP, SSH, OAuth, HTTPS, SFTP Experience in building and supporting multiple integrations Hands-on experience with MCP (Model Context Protocol) and AI agent integrations. Strong understanding of AI integration architecture and intelligent automation. Full life cycle implementation experience from requirements gathering/analysis to Go-Live and Post production support. Expert in GitHub and CI/CD. Experience with Relational and NoSQL databases including ability to write, review and suggest PL/SQL code optimization. Experience in publishing and consuming web services, and their governance and administration. Nice to have exposure in automations and end-to-end integrations using Oracle BIP ,Object storage and IAM/IDCS. Financial domain knowledge is an added advantage. Eager to take responsibility, accountability and ownership of systems and processes Enthusiastic about expanding AI capabilities while working with the team’s tools and platforms. Possesses strong verbal and written communication skills. Engineering & Technology Bangalore, India",Entry Level,greenhouse,https://careers.airbnb.com/positions/7902817?gh_jid=7902817,2026-06-10T18:17:27.907111+00:00,True,"systems engineer, biztech(python, llm, genai, mcp)","airbnb was born in 2007 when two hosts welcomed three guests to their san francisco home, and has since grown to over 5 million hosts who have welcomed over 2 billion guest arrivals in almost every country across the globe. every day, hosts offer unique stays and experiences that make it possible for guests to connect with communities in a more authentic way. systems engineer airbnb | india airbnb has built a global platform that connects travellers and hosts across 34,000 cities, offering more than two million listings worldwide. we run mission-critical enterprise systems that operate around the clock across all time zones. these systems are essential to enabling our teams to work efficiently and productively. as our business technology organization continues to expand, we are seeking highly motivated individuals who thrive in a fast-paced, high-performing team environment. the systems engineer role focuses on designing, building, and maintaining finance integrations and reports on oracle. the role is part of a team that builds and maintains the enterprise platform powering airbnb's business operations; spanning finance, procurement, analytics, and internal tooling. while oracle/finance integrations are a core area, you'll also contribute to ai-assisted automation, and cross-functional systems that serve teams across the company. role & responsibilities: design, build and manage integrations and micro services in python. design and build ai-assisted automations and mcp integrations to extend internal platform capabilities. document the designs and runbooks and participate in the full software development life cycle (sdlc). share knowledge with other members in the team. support the application infrastructure including oci and more. understanding the requirements for different oracle modules and coming up with solutions to review with the team and present to stakeholders. requirements: bachelors in computer science or engineering 5+ years experience in python programming language. experience in securing data; understands pgp, ssh, oauth, https, sftp experience in building and supporting multiple integrations hands-on experience with mcp (model context protocol) and ai agent integrations. strong understanding of ai integration architecture and intelligent automation. full life cycle implementation experience from requirements gathering/analysis to go-live and post production support. expert in github and ci/cd. experience with relational and nosql databases including ability to write, review and suggest pl/sql code optimization. experience in publishing and consuming web services, and their governance and administration. nice to have exposure in automations and end-to-end integrations using oracle bip ,object storage and iam/idcs. financial domain knowledge is an added advantage. eager to take responsibility, accountability and ownership of systems and processes enthusiastic about expanding ai capabilities while working with the team’s tools and platforms. possesses strong verbal and written communication skills. engineering & technology bangalore, india","['python', 'sql', 'ci/cd']","python, sql, ci/cd",Analytics,dictionary,
greenhouse:stripe:7874654,"Data Analyst, Financial Enablement",stripe,"Dublin, Ireland","Who we are About Stripe Stripe is a financial infrastructure platform for businesses. Millions of companies—from the world's largest enterprises to the most ambitious startups—use Stripe to accept payments, grow their revenue, and accelerate new business opportunities. Our mission is to increase the GDP of the internet, and we have a staggering amount of work ahead. That means you have an unprecedented opportunity to put the global economy within everyone's reach while doing the most important work of your career. About the team The Internal System Org is at the core of Stripe to empower business-critical financial domains including Finance and Strategy, Accounting, Tax, Treasury, Product Experience, and GTM. We are the Financial Enablement team, acting as the centralized data analytics team for Internal System Org. We enable and empower Finance and Strategy, GTM, Accounting, and Product teams to achieve business goals through dataset development, data analytics support, dashboards, AI, and operational efficiency enhancements. What you'll do You're passionate about solving business problems and making a direct impact on the business. You thrive in environments with many moving parts and quickly pick up new domain knowledge and technologies (e.g., AI). We're looking for someone with strong communication skills and advanced SQL and analytics abilities. A background in Accounting or Finance, or prior AI experience, is a strong plus, though these can also be developed on the job. Responsibilities Perform data analysis, identify trends, conduct research, and build visualizations to deliver objective, critical insights that fulfill team stakeholders' business needs Work closely with cross-functional teams, including Finance and Strategy, Accounting, Product, Tax, User Billing, Seller System, and Sales Ops teams, to align on financial goals and drive revenue growth Work closely with Engineering and Product teams to help define product solutions Leverage AI tools to improve teamwork efficiency Who you are We're looking for someone who meets the minimum requirements to be considered for the role. If you meet these requirements, you are encouraged to apply. The preferred qualifications are a bonus, not a requirement. Minimum requirements Bachelor's degree in a STEM major (e.g., Computer Science, Mathematics, Statistics, Engineering) and 4+ years of experience in data analysis Strong problem-solving ability, proficiency with SQL (minimum of 3 years of advanced SQL), and strong understanding of data relationships Experience working with large datasets Strong project management skills Domain knowledge in Finance, Accounting, and GTM Preferred qualifications Experience working in fast-paced environments (e.g., high-growth fintech or tech company, management consulting) Experience working with PMs, Engineers, GTM, Accounting, or Finance teams Experience working with financial datasets Experience with AI tools (Claude Code, Kai, etc.) Qualification in Accounting or Finance, or CPA or CFA certification 7420 Finance Systems Ireland Locations",Entry Level,greenhouse,https://stripe.com/jobs/search?gh_jid=7874654,2026-06-10T18:17:28.168414+00:00,True,"data analyst, financial enablement","who we are about stripe stripe is a financial infrastructure platform for businesses. millions of companies—from the world's largest enterprises to the most ambitious startups—use stripe to accept payments, grow their revenue, and accelerate new business opportunities. our mission is to increase the gdp of the internet, and we have a staggering amount of work ahead. that means you have an unprecedented opportunity to put the global economy within everyone's reach while doing the most important work of your career. about the team the internal system org is at the core of stripe to empower business-critical financial domains including finance and strategy, accounting, tax, treasury, product experience, and gtm. we are the financial enablement team, acting as the centralized data analytics team for internal system org. we enable and empower finance and strategy, gtm, accounting, and product teams to achieve business goals through dataset development, data analytics support, dashboards, ai, and operational efficiency enhancements. what you'll do you're passionate about solving business problems and making a direct impact on the business. you thrive in environments with many moving parts and quickly pick up new domain knowledge and technologies (e.g., ai). we're looking for someone with strong communication skills and advanced sql and analytics abilities. a background in accounting or finance, or prior ai experience, is a strong plus, though these can also be developed on the job. responsibilities perform data analysis, identify trends, conduct research, and build visualizations to deliver objective, critical insights that fulfill team stakeholders' business needs work closely with cross-functional teams, including finance and strategy, accounting, product, tax, user billing, seller system, and sales ops teams, to align on financial goals and drive revenue growth work closely with engineering and product teams to help define product solutions leverage ai tools to improve teamwork efficiency who you are we're looking for someone who meets the minimum requirements to be considered for the role. if you meet these requirements, you are encouraged to apply. the preferred qualifications are a bonus, not a requirement. minimum requirements bachelor's degree in a stem major (e.g., computer science, mathematics, statistics, engineering) and 4+ years of experience in data analysis strong problem-solving ability, proficiency with sql (minimum of 3 years of advanced sql), and strong understanding of data relationships experience working with large datasets strong project management skills domain knowledge in finance, accounting, and gtm preferred qualifications experience working in fast-paced environments (e.g., high-growth fintech or tech company, management consulting) experience working with pms, engineers, gtm, accounting, or finance teams experience working with financial datasets experience with ai tools (claude code, kai, etc.) qualification in accounting or finance, or cpa or cfa certification 7420 finance systems ireland locations","['sql', 'statistics', 'dashboards']","sql, statistics, dashboards",Analytics,dictionary,
