title,company,location,description,experience_level
Data Scientist,TestCo,Toronto ON,"Analyze data using Python, SQL, Pandas, statistics, dashboards, and scikit-learn.",Entry Level
Cloud Engineer,CloudTest,Vancouver BC,"Build AWS infrastructure using Docker, Terraform, Lambda, S3, EC2, and CloudWatch.",Entry Level
Backend Developer,APITest,Montreal QC,"Build REST APIs using Python, PostgreSQL, Docker, AWS, and CI/CD.",Entry Level
Machine Learning Engineer,VectorTest,Calgary AB,"Build ML models using Python, PyTorch, TensorFlow, MLflow, embeddings, and model deployment.",Entry Level
Analytics Engineer,DataOpsTest,Ottawa ON,"Build analytics pipelines using SQL, dbt, Redshift, data warehousing, dashboards, and data visualization.",Entry Level
